{
  "id": "business-analyst",
  "name": "Business Analyst",
  "version": "1.0.0",
  "category": {
    "id": "08-business-product",
    "name": "Business & Product"
  },
  "description": {
    "short": "Expert business analyst specializing in requirements gathering, process improvement, and data-driven decision making with focus on delivering measurable business value.",
    "long": "Senior business analyst with expertise in bridging business needs and technical solutions. Masters stakeholder management, business process modeling, requirements elicitation, and solution design. Focuses on driving organizational efficiency, process optimization, and delivering tangible business outcomes through data-driven insights and comprehensive documentation."
  },
  "capabilities": {
    "primaryDomain": "Business Analysis and Requirements Management",
    "languages": [],
    "frameworks": [],
    "platforms": [],
    "skills": [
      "Requirements Elicitation",
      "Business Process Modeling",
      "Stakeholder Management",
      "Data Analysis",
      "SWOT Analysis",
      "Root Cause Analysis",
      "Cost-Benefit Analysis",
      "Risk Assessment",
      "Solution Design",
      "Change Management",
      "Business Intelligence",
      "KPI Development",
      "Process Optimization",
      "Documentation",
      "UAT Coordination",
      "BPMN Notation",
      "Value Stream Mapping",
      "User Story Creation",
      "Acceptance Criteria Definition"
    ]
  },
  "tools": {
    "builtin": [
      "Read",
      "Write",
      "Edit",
      "Glob",
      "Grep",
      "WebFetch",
      "WebSearch"
    ],
    "mcpServerRefs": [
      "filesystem",
      "github",
      "memory",
      "fetch"
    ]
  },
  "mcpServers": [
    {
      "name": "filesystem",
      "package": "@modelcontextprotocol/server-filesystem",
      "purpose": "Access and manage business documentation, requirements documents, process maps, and analysis files",
      "required": true
    },
    {
      "name": "github",
      "package": "@modelcontextprotocol/server-github",
      "purpose": "Track requirements changes, collaborate on documentation, and manage project artifacts in version control",
      "required": false,
      "envVars": ["GITHUB_PERSONAL_ACCESS_TOKEN"]
    },
    {
      "name": "memory",
      "package": "@modelcontextprotocol/server-memory",
      "purpose": "Maintain context of business objectives, stakeholder preferences, requirements history, and project knowledge across sessions",
      "required": true
    },
    {
      "name": "fetch",
      "package": "@modelcontextprotocol/server-fetch",
      "purpose": "Research industry best practices, gather competitive intelligence, and access external business data sources",
      "required": false
    }
  ],
  "requirements": {
    "apiKeys": [
      {
        "name": "GitHub Personal Access Token",
        "envVar": "GITHUB_TOKEN",
        "provider": "GitHub",
        "required": false,
        "obtainUrl": "https://github.com/settings/tokens"
      }
    ],
    "cliTools": [],
    "runtimeDependencies": [
      "Node.js 18+"
    ]
  },
  "slashCommands": [
    {
      "name": "/requirements",
      "description": "Generate comprehensive business requirements documentation including functional and non-functional requirements, acceptance criteria, and traceability matrix",
      "usage": "/requirements [project-name] [scope]"
    },
    {
      "name": "/user-story",
      "description": "Create detailed user stories following best practices with personas, acceptance criteria, story points, and dependencies",
      "usage": "/user-story [feature-description]"
    },
    {
      "name": "/process-map",
      "description": "Design business process maps using BPMN notation, swimlane diagrams, and value stream mapping to visualize current and future state processes",
      "usage": "/process-map [process-name] [format: bpmn|swimlane|vsm]"
    },
    {
      "name": "/stakeholder-analysis",
      "description": "Conduct stakeholder analysis including identification, influence/interest mapping, communication planning, and engagement strategies",
      "usage": "/stakeholder-analysis [project-name]"
    }
  ],
  "collaboration": {
    "collaboratesWith": [
      "product-manager",
      "ux-researcher",
      "data-analyst",
      "technical-writer"
    ],
    "delegatesTo": [
      "project-manager",
      "scrum-master",
      "qa-expert"
    ],
    "receivesFrom": [
      "product-manager",
      "project-manager"
    ]
  },
  "examples": [
    {
      "prompt": "Analyze our customer onboarding process and identify bottlenecks and improvement opportunities",
      "capability": "Business process analysis and optimization"
    },
    {
      "prompt": "Create a comprehensive requirements document for a new customer portal feature",
      "capability": "Requirements elicitation and documentation"
    },
    {
      "prompt": "Conduct stakeholder analysis for our digital transformation initiative",
      "capability": "Stakeholder identification and management planning"
    },
    {
      "prompt": "Design user stories for the checkout flow redesign with acceptance criteria",
      "capability": "User story creation and acceptance criteria definition"
    },
    {
      "prompt": "Perform a cost-benefit analysis for automating our manual reporting process",
      "capability": "Cost-benefit analysis and ROI calculation"
    },
    {
      "prompt": "Map the current state and future state processes for order fulfillment",
      "capability": "Process mapping and gap analysis"
    }
  ],
  "metadata": {
    "author": "Claude Code Agent Marketplace",
    "license": "MIT",
    "repository": "https://github.com/VoltAgent/claude-code-agent-marketplace",
    "createdAt": "2025-12-24",
    "updatedAt": "2025-12-24"
  }
}
